-----------
How to read
-----------

URB addr         Stamp (us) Submit/Callback
|                |          |
ffff880225d99480 2924484325 S Co:1:004:0 s 21 09 0200 0001 0008 8 = 01803301 00000000
ffff880225d99480 2924484800 C Co:1:004:0 0 8 >
ffff8801cbf08540 2924490463 C Ii:1:004:2 0:8 8 = 80041860 14002e33
ffff8801cbf083c0 2924491609 S Ii:1:004:2 -115:8 8 <

Control out/Interrupt in:bus nb:device addr:endpoint
 \                        \      \          /
  \                        \      -\   /----
   \                        -----\ |   |
    --------------------------\  | |   |
ffff880225d99480 2924484325 S Co:1:004:0 s 21 09 0200 0001 0008 8 = 01803301 00000000
ffff880225d99480 2924484800 C Co:1:004:0 0 8 >
ffff8801cbf08540 2924490463 C Ii:1:004:2 0:8 8 = 80041860 14002e33
ffff8801cbf083c0 2924491609 S Ii:1:004:2 -115:8 8 <

URB status word = status(no sense for Submit):interval:start frame:error count
 \  When submitting a control packet = setup tag + 5 bytes with the form    /
  \                                     \ ReqType Request Val Index Length /
   \                                     \ \     /       /   /      /     /
    \                                    | |    / /------   /      /     /
     \                                   | |   / /    /-----      /     /
      \                                  | |  |  |    |    /------     /
       ---------------------------------\| |  |  |    |    |   /-------
ffff880225d99480 2924484325 S Co:1:004:0 s 21 09 0200 0001 0008 8 = 01803301 00000000
ffff880225d99480 2924484800 C Co:1:004:0 0 8 >
ffff8801cbf08540 2924490463 C Ii:1:004:2 0:8 8 = 80041860 14002e33
ffff8801cbf083c0 2924491609 S Ii:1:004:2 -115:8 8 <

Data length (requested or actual) Data tag (data is present only when '=') Data words (byte stream, BE)
 \                                 \                                      /
  \                                 ------------------------------\ /-----
   -------------------------------------------------------------\ | |
ffff880225d99480 2924484325 S Co:1:004:0 s 21 09 0200 0001 0008 8 = 01803301 00000000
ffff880225d99480 2924484800 C Co:1:004:0 0 8 >
ffff8801cbf08540 2924490463 C Ii:1:004:2 0:8 8 = 80041860 14002e33
ffff8801cbf083c0 2924491609 S Ii:1:004:2 -115:8 8 <

-----------
Real stream
-----------

ffff880225d99480 2924484325 S Co:1:004:0 s 21 09 0200 0001 0008 8 = 01803301 00000000
ffff880225d99480 2924484800 C Co:1:004:0 0 8 >
ffff8801cbf08540 2924490463 C Ii:1:004:2 0:8 8 = 80041860 14002e33
ffff8801cbf083c0 2924491609 S Ii:1:004:2 -115:8 8 <

ffff8801cbf08e40 2926472711 S Co:1:004:0 s 21 09 0200 0001 0008 8 = 01803301 00000000
ffff8801cbf08e40 2926473183 C Co:1:004:0 0 8 >
ffff8801cbf083c0 2926474474 C Ii:1:004:2 0:8 8 = 80041860 13e02e33
ffff8801cbf086c0 2926481912 S Ii:1:004:2 -115:8 8 <
                                         
ffff8801cbf08300 2928482712 S Co:1:004:0 s 21 09 0200 0001 0008 8 = 01803301 00000000
ffff8801cbf08300 2928483184 C Co:1:004:0 0 8 >
ffff8801cbf086c0 2928490485 C Ii:1:004:2 0:8 8 = 80041860 13e02e33
ffff8801cbf08480 2928491633 S Ii:1:004:2 -115:8 8 <

ffff880225d99480 2930492584 S Co:1:004:0 s 21 09 0200 0001 0008 8 = 01803301 00000000
ffff880225d99480 2930493057 C Co:1:004:0 0 8 >
ffff8801cbf08480 2930498496 C Ii:1:004:2 0:8 8 = 80041860 14002e33
ffff8801cbf08300 2930499643 S Ii:1:004:2 -115:8 8 <

ffff8801cbf08180 2932480539 S Co:1:004:0 s 21 09 0200 0001 0008 8 = 01803301 00000000
ffff8801cbf08180 2932481011 C Co:1:004:0 0 8 >
ffff8801cbf08300 2932482507 C Ii:1:004:2 0:8 8 = 80041860 13e02e33
ffff880225d99480 2932489886 S Ii:1:004:2 -115:8 8 <
